{
  "schema_version": 1,
  "benchmark_id": "pdf-tools.comparison.v1",
  "benchmark_version": "v0.1.0",
  "generator": "scripts/eval-generate-comparison-fixtures.mjs",
  "normalization_profile": {
    "version": 1,
    "unicode": "NFC",
    "whitespace": "collapse-trim",
    "case_sensitive": true,
    "dates": "preserve-lexeme",
    "currency": "preserve-code-symbol-and-digits",
    "volatile_metadata_keys": ["CreationDate", "ModDate", "Producer", "Creator"]
  },
  "canonical_renderer": {
    "version": 1,
    "pdfjs_dist": "5.4.624",
    "canvas": "0.1.99",
    "scale": 2,
    "dpi": 144,
    "page_box": "CropBox-or-MediaBox",
    "rotation": "intrinsic-before-scale",
    "canvas_rounding": "ceil",
    "background_rgba": [255, 255, 255, 255],
    "color_space": "sRGB",
    "region_rounding": "floor-min-ceil-max-after-rotation-and-scale",
    "is_eval_supported": false,
    "use_worker_fetch": false,
    "use_system_fonts": false,
    "use_wasm": false,
    "system_renderer_fallback": false,
    "pixel_delta_threshold": 8,
    "mask_dilation_pixels": 1,
    "connected_components": 8,
    "minimum_component_area_pixels": 4
  },
  "documents": [
    {
      "id": "pdf-tools.comparison.document.base",
      "path": "synthetic/comparison-base.pdf",
      "sha256": "83228dc849486ef78b8be0f663e9daa8a7641a9d0cc7c6af9a5f443ae5fcc4dc",
      "media_type": "application/pdf",
      "provenance": { "kind": "synthetic", "origin": "Open Document Alliance PDF Tools comparison corpus", "generator": "scripts/eval-generate-comparison-fixtures.mjs" },
      "license": { "name": "MIT License", "spdx_id": "MIT", "url": "https://opensource.org/license/mit", "redistribution": "allowed" },
      "privacy": { "class": "synthetic", "contains_personal_data": false, "notes": "Fixed fictional terms and shapes; no personal data." }
    },
    {
      "id": "pdf-tools.comparison.document.material-text-after",
      "path": "synthetic/comparison-material-text-after.pdf",
      "sha256": "ddf4105dc11900cb8165ac42318f14d8480c87b6e97ef5a58b7201beea044990",
      "media_type": "application/pdf",
      "provenance": { "kind": "synthetic", "origin": "Open Document Alliance PDF Tools comparison corpus", "generator": "scripts/eval-generate-comparison-fixtures.mjs" },
      "license": { "name": "MIT License", "spdx_id": "MIT", "url": "https://opensource.org/license/mit", "redistribution": "allowed" },
      "privacy": { "class": "synthetic", "contains_personal_data": false, "notes": "Fixed fictional terms and shapes; no personal data." }
    },
    {
      "id": "pdf-tools.comparison.document.visual-status-after",
      "path": "synthetic/comparison-visual-status-after.pdf",
      "sha256": "a74469341ee92cf83dfd292e887fb7bce77ba5c14eaeac9750873e14a06d8717",
      "media_type": "application/pdf",
      "provenance": { "kind": "synthetic", "origin": "Open Document Alliance PDF Tools comparison corpus", "generator": "scripts/eval-generate-comparison-fixtures.mjs" },
      "license": { "name": "MIT License", "spdx_id": "MIT", "url": "https://opensource.org/license/mit", "redistribution": "allowed" },
      "privacy": { "class": "synthetic", "contains_personal_data": false, "notes": "Fixed fictional terms and shapes; no personal data." }
    },
    {
      "id": "pdf-tools.comparison.document.layout-noise-after",
      "path": "synthetic/comparison-layout-noise-after.pdf",
      "sha256": "22b258147cc852308f3a6663d251601c5ad30c4aa6e923137ba958e46eb67863",
      "media_type": "application/pdf",
      "provenance": { "kind": "synthetic", "origin": "Open Document Alliance PDF Tools comparison corpus", "generator": "scripts/eval-generate-comparison-fixtures.mjs" },
      "license": { "name": "MIT License", "spdx_id": "MIT", "url": "https://opensource.org/license/mit", "redistribution": "allowed" },
      "privacy": { "class": "synthetic", "contains_personal_data": false, "notes": "Fixed fictional terms and shapes; no personal data." }
    },
    {
      "id": "pdf-tools.comparison.document.metadata-only-after",
      "path": "synthetic/comparison-metadata-only-after.pdf",
      "sha256": "c5fb3b62c4e6db7e4259ef98b6c1820660b75312240468e8cc97373ac671996b",
      "media_type": "application/pdf",
      "provenance": { "kind": "synthetic", "origin": "Open Document Alliance PDF Tools comparison corpus", "generator": "scripts/eval-generate-comparison-fixtures.mjs" },
      "license": { "name": "MIT License", "spdx_id": "MIT", "url": "https://opensource.org/license/mit", "redistribution": "allowed" },
      "privacy": { "class": "synthetic", "contains_personal_data": false, "notes": "Fixed fictional terms and shapes; no personal data." }
    },
    {
      "id": "pdf-tools.comparison.document.pages-reordered-after",
      "path": "synthetic/comparison-pages-reordered-after.pdf",
      "sha256": "4eb4f4052ffdf8a376faec575f5dcac846fe23ef180c6b1c23a0434425b8b138",
      "media_type": "application/pdf",
      "provenance": { "kind": "synthetic", "origin": "Open Document Alliance PDF Tools comparison corpus", "generator": "scripts/eval-generate-comparison-fixtures.mjs" },
      "license": { "name": "MIT License", "spdx_id": "MIT", "url": "https://opensource.org/license/mit", "redistribution": "allowed" },
      "privacy": { "class": "synthetic", "contains_personal_data": false, "notes": "Fixed fictional terms and shapes; no personal data." }
    },
    {
      "id": "pdf-tools.comparison.document.form-annotation-after",
      "path": "synthetic/comparison-form-annotation-after.pdf",
      "sha256": "b22a4cdc515cbc392a1dba81123c00728d5c607a3c7024e14378b734d98ddce0",
      "media_type": "application/pdf",
      "provenance": { "kind": "synthetic", "origin": "Open Document Alliance PDF Tools comparison corpus", "generator": "scripts/eval-generate-comparison-fixtures.mjs" },
      "license": { "name": "MIT License", "spdx_id": "MIT", "url": "https://opensource.org/license/mit", "redistribution": "allowed" },
      "privacy": { "class": "synthetic", "contains_personal_data": false, "notes": "Fixed fictional terms and shapes; no personal data." }
    }
  ],
  "pairs": [
    {
      "id": "pdf-tools.comparison.pair.identical",
      "role": "identical",
      "partition": "development",
      "before_document_id": "pdf-tools.comparison.document.base",
      "after_document_id": "pdf-tools.comparison.document.base",
      "required_channels": ["semantic", "text", "structure", "form_field", "annotation", "metadata", "visual"],
      "alignments": [
        { "before_page": 1, "after_page": 1, "relation": "same", "anchor": "PAGE-ID: SERVICE" },
        { "before_page": 2, "after_page": 2, "relation": "same", "anchor": "PAGE-ID: APPENDIX" }
      ],
      "events": []
    },
    {
      "id": "pdf-tools.comparison.pair.material-text",
      "role": "material_text",
      "partition": "development",
      "before_document_id": "pdf-tools.comparison.document.base",
      "after_document_id": "pdf-tools.comparison.document.material-text-after",
      "required_channels": ["semantic", "text", "visual"],
      "alignments": [
        { "before_page": 1, "after_page": 1, "relation": "same", "anchor": "PAGE-ID: SERVICE" },
        { "before_page": 2, "after_page": 2, "relation": "same", "anchor": "PAGE-ID: APPENDIX" }
      ],
      "events": [
        {
          "id": "truth.monthly-fee",
          "salience": "material",
          "summary": "Monthly fee changes from USD 10,000 to USD 12,500.",
          "presentation": { "default_material": "report", "forensic": "report" },
          "facets": [
            { "channel": "semantic", "mandatory": true, "operation": "modified", "before": { "document_id": "pdf-tools.comparison.document.base", "document_sha256": "83228dc849486ef78b8be0f663e9daa8a7641a9d0cc7c6af9a5f443ae5fcc4dc", "page": 1, "page_box": [0, 0, 612, 792], "rotation": 0, "region": [72, 131.5, 156.408, 14], "value_sha256": "f005019dc391b02c329a224f4d62be4e116cad1e26c3d44936d1b033faa534d6" }, "after": { "document_id": "pdf-tools.comparison.document.material-text-after", "document_sha256": "ddf4105dc11900cb8165ac42318f14d8480c87b6e97ef5a58b7201beea044990", "page": 1, "page_box": [0, 0, 612, 792], "rotation": 0, "region": [72, 131.5, 156.408, 14], "value_sha256": "4f399cb9824690836996645c1ea8af71d934705464d61d6c01ec0839841a33d4" } },
            { "channel": "text", "mandatory": true, "operation": "modified", "before": { "document_id": "pdf-tools.comparison.document.base", "document_sha256": "83228dc849486ef78b8be0f663e9daa8a7641a9d0cc7c6af9a5f443ae5fcc4dc", "page": 1, "page_box": [0, 0, 612, 792], "rotation": 0, "region": [72, 131.5, 156.408, 14], "value_sha256": "f005019dc391b02c329a224f4d62be4e116cad1e26c3d44936d1b033faa534d6" }, "after": { "document_id": "pdf-tools.comparison.document.material-text-after", "document_sha256": "ddf4105dc11900cb8165ac42318f14d8480c87b6e97ef5a58b7201beea044990", "page": 1, "page_box": [0, 0, 612, 792], "rotation": 0, "region": [72, 131.5, 156.408, 14], "value_sha256": "4f399cb9824690836996645c1ea8af71d934705464d61d6c01ec0839841a33d4" } },
            { "channel": "visual", "mandatory": true, "operation": "modified", "before": { "document_id": "pdf-tools.comparison.document.base", "document_sha256": "83228dc849486ef78b8be0f663e9daa8a7641a9d0cc7c6af9a5f443ae5fcc4dc", "page": 1, "page_box": [0, 0, 612, 792], "rotation": 0, "region": [72, 131.5, 156.408, 14], "value_sha256": "0ff3b83abe6351db6b958a1dbdb337d7f5cbf7c3838ebe4b9f6c17c25c4046af" }, "after": { "document_id": "pdf-tools.comparison.document.material-text-after", "document_sha256": "ddf4105dc11900cb8165ac42318f14d8480c87b6e97ef5a58b7201beea044990", "page": 1, "page_box": [0, 0, 612, 792], "rotation": 0, "region": [72, 131.5, 156.408, 14], "value_sha256": "b206807eb21aceb03d52554434d7eab239ec0f04d82743d1dbb04151e68df397" } }
          ]
        },
        {
          "id": "truth.termination-notice",
          "salience": "material",